{
  "vertices": ["s", "a", "b", "c", "z"],
  "source": "s",
  "edges": [
    {"u": "s", "v": "a", "w": 2},
    {"u": "s", "v": "b", "w": 5},
    {"u": "a", "v": "b", "w": -1},
    {"u": "b", "v": "c", "w": 2},
    {"u": "a", "v": "c", "w": 5}
  ],
  "distance": {"s": 0, "a": 2, "b": 1, "c": 3, "z": null},
  "parent": {
    "s": null,
    "a": {"u": "s", "edge": 0},
    "b": {"u": "a", "edge": 2},
    "c": {"u": "b", "edge": 3},
    "z": null
  }
}
